{
  "$schema": "https://github.com/Emily2040/seedance-2.0/schemas/evidence-capture.schema.json",
  "capture_id": "bytedance.seedance-2-0.model-page.2026-07-11.normalized",
  "source_snapshot_id": "bytedance.seedance-2-0.model-page.2026-07-11",
  "capture_kind": "normalized_evidence",
  "created_at": "2026-07-11",
  "canonical_url": "https://seed.bytedance.com/en/seedance2_0",
  "final_url": "https://seed.bytedance.com/en/seedance2_0",
  "raw_document_sha256": "bea405ac7d573ca77ee8243d58be87f5d3081aaf2f852e97b6b6fb8cea650100",
  "normalization": "The public model page was reduced to two bounded model-level capability statements and excludes self-reported benchmark conclusions.",
  "rights_note": "Only short factual paraphrases and page section locators are retained; showcase media and marketing copy are excluded.",
  "items": [
    {
      "evidence_item_id": "bytedance.model.multimodal-inputs",
      "locator": {"heading_path": ["Seedance 2.0"], "fragment_hint": "unified multimodal"},
      "normalized_evidence": "ByteDance's model page identifies Seedance 2.0 as a unified audio-video generation model that accepts text, image, audio, and video inputs.",
      "normalized_evidence_sha256": "876ae5df061903520337efbf6c74e4856e47407bb1c8eb59611cb799fd562df1"
    },
    {
      "evidence_item_id": "bytedance.model.reference-control-dimensions",
      "locator": {"heading_path": ["Create with Director-level Control"], "fragment_hint": "performance"},
      "normalized_evidence": "The model page says image, audio, and video references can guide performance, lighting, shadow, and camera movement at the model-description level.",
      "normalized_evidence_sha256": "b3394f335d67ab69e72c5af20eb9559165d5f030e73e14530cdbbc67b03e0e86"
    }
  ],
  "notes": "This capture does not support API limits, provider availability, pricing, or independent quality claims."
}
