{
  "$schema": "https://github.com/Emily2040/seedance-2.0/schemas/evidence-capture.schema.json",
  "capture_id": "fal.reference-to-video.2026-07-11.normalized",
  "source_snapshot_id": "fal.reference-to-video.2026-07-11",
  "capture_kind": "normalized_evidence",
  "created_at": "2026-07-11",
  "canonical_url": "https://fal.ai/models/bytedance/seedance-2.0/reference-to-video/api",
  "final_url": "https://fal.ai/api/openapi/queue/openapi.json?endpoint_id=bytedance/seedance-2.0/reference-to-video",
  "raw_document_sha256": "8a658b8050bb76feb1497337e6abc14aebf179aaad997740a5c6c7396c2b9713",
  "normalization": "The provider OpenAPI schema was reduced to field, enum, and prompt-binding observations needed by the registered claims.",
  "rights_note": "Only normalized schema facts are retained; the complete provider OpenAPI document is not committed.",
  "items": [
    {
      "evidence_item_id": "fal.reference.binding-arrays",
      "locator": {"heading_path": ["Seedance2R2VInput", "properties"], "fragment_hint": "image_urls"},
      "normalized_evidence": "fal's reference-to-video input uses separate image, video, and audio URL arrays, and its field descriptions use compact at-sign ordinals such as Image1, Video1, and Audio1 for prompt references.",
      "normalized_evidence_sha256": "1426857f09070f7461fda78ba8482f203b0af409ccad02a1acec0be0b63746d8"
    },
    {
      "evidence_item_id": "fal.reference.input-no-seed",
      "locator": {"heading_path": ["Seedance2R2VInput", "x-fal-order-properties"], "fragment_hint": "end_user_id"},
      "normalized_evidence": "The current fal reference-to-video input schema lists prompt, media arrays, resolution, duration, aspect ratio, audio generation, bitrate mode, and end-user ID; it does not list seed as an input field.",
      "normalized_evidence_sha256": "f4eaaf04cd72ef60f74c24af7ec6530c584129681210e6a89ad533d81e5f6956"
    },
    {
      "evidence_item_id": "fal.reference.resolution-4k",
      "locator": {"heading_path": ["Seedance2R2VInput", "resolution"], "fragment_hint": "4k"},
      "normalized_evidence": "The current standard fal reference-to-video schema enumerates 4k among its resolution values, while other variants can expose narrower resolution sets.",
      "normalized_evidence_sha256": "5fd8b57d648bbaf78c6261683a013c8e17e93be13ed5d53213cd23e700eac6f2"
    }
  ],
  "notes": "These observations are volatile provider API fields and require a seven-day or shorter refresh policy."
}
